{
  "shoppingListVersion": "1",
  "id": "team-shop",
  "basis": {
    "sourceRevision": "3d9f2aac7fb3f76225d315e34ec5aad7d00dcf96",
    "selection": [
      {
        "menuPlanRef": "team-week",
        "date": "2026-09-14",
        "mealType": "lunch"
      }
    ]
  },
  "items": [
    {
      "ingredientRef": "cooking-oil",
      "decision": "buy",
      "bought": true
    },
    {
      "ingredientRef": "salt",
      "decision": "available"
    },
    {
      "ingredientRef": "tomato",
      "decision": "check",
      "previous": {
        "basis": {
          "sourceRevision": "3d9f2aac7fb3f76225d315e34ec5aad7d00dcf96",
          "selection": [
            {
              "menuPlanRef": "team-week",
              "date": "2026-09-14",
              "mealType": "lunch"
            }
          ]
        },
        "decision": "buy",
        "bought": true
      }
    },
    {
      "ingredientRef": "tomato-other",
      "decision": "check"
    }
  ]
}
